{
  "$schema": "http://json-schema.org/draft-07/schema#",
  "type": "object",
  "required": ["$schema", "schema_version", "network_id", "generated_at", "source", "records"],
  "properties": {
    "$schema": {
      "type": "string"
    },
    "schema_version": {
      "type": "string"
    },
    "network_id": {
      "type": "string"
    },
    "generated_at": {
      "type": "string"
    },
    "source": {
      "type": "array",
      "items": {
        "type": "object",
        "required": [
          "name",
          "url",
          "version",
          "retrieved_at",
          "license",
          "license_url",
          "attribution"
        ],
        "properties": {
          "name": {
            "type": "string"
          },
          "url": {
            "type": "string"
          },
          "version": {
            "type": "string"
          },
          "retrieved_at": {
            "type": "string"
          },
          "license": {
            "type": "string",
            "enum": ["unknown", "cc0", "cc-by", "cc-by-sa", "odbl", "custom"]
          },
          "license_url": {
            "anyOf": [
              {
                "type": "string"
              },
              {
                "type": "null"
              }
            ]
          },
          "attribution": {
            "type": "string"
          },
          "notes": {
            "type": "string"
          }
        },
        "additionalProperties": false
      }
    },
    "records": {
      "type": "array",
      "items": {
        "type": "object",
        "required": [
          "id",
          "line_id",
          "stop_ids",
          "origin_stop_id",
          "terminal_stop_id",
          "is_primary",
          "source_ids"
        ],
        "properties": {
          "id": {
            "type": "string"
          },
          "line_id": {
            "type": "string"
          },
          "name": {
            "type": "string"
          },
          "names": {
            "type": "object",
            "required": ["zh", "en"],
            "properties": {
              "zh": {
                "type": "string"
              },
              "en": {
                "type": "string"
              }
            },
            "additionalProperties": false
          },
          "stop_ids": {
            "type": "array",
            "items": {
              "type": "string"
            }
          },
          "origin_stop_id": {
            "type": "string"
          },
          "terminal_stop_id": {
            "type": "string"
          },
          "is_primary": {
            "type": "boolean"
          },
          "junction_stop_id": {
            "type": "string"
          },
          "color": {
            "type": "string"
          },
          "geometry_reference_pattern_id": {
            "type": "string"
          },
          "source_ids": {
            "type": "array",
            "items": {
              "type": "object",
              "required": ["source", "id"],
              "properties": {
                "source": {
                  "type": "string"
                },
                "id": {
                  "type": "string"
                }
              },
              "additionalProperties": false
            }
          },
          "extras": {
            "type": "object",
            "required": [],
            "properties": {},
            "additionalProperties": {
              "$id": "/schemas/unknown",
              "title": "unknown"
            }
          }
        },
        "additionalProperties": false
      }
    }
  },
  "additionalProperties": false
}
