{
  "$schema": "https://raw.githubusercontent.com/Naptie/openmetro/main/schemas/v1/patterns.schema.json",
  "schema_version": "1.0",
  "network_id": "cn-shijiazhuang",
  "generated_at": "2026-10-22T16:23:12.004Z",
  "source": [],
  "records": [
    {
      "id": "cn-shijiazhuang-line-1-pattern-cn-shijiazhuang-xiwang-1-to-cn-shijiazhuang-fuze-1",
      "line_id": "cn-shijiazhuang-line-1",
      "name": "1号线",
      "names": {
        "zh": "1号线",
        "en": "Line 1"
      },
      "stop_ids": [
        "cn-shijiazhuang-xiwang-1",
        "cn-shijiazhuang-shiguang-jie-1",
        "cn-shijiazhuang-changcheng-qiao-1",
        "cn-shijiazhuang-heping-yiyuan-1",
        "cn-shijiazhuang-lieshi-lingyuan-1",
        "cn-shijiazhuang-xinbai-guangchang-1",
        "cn-shijiazhuang-jiefang-guangchang-1",
        "cn-shijiazhuang-pingan-dajie-1",
        "cn-shijiazhuang-beiguo-shangcheng-1",
        "cn-shijiazhuang-bowuyuan-1",
        "cn-shijiazhuang-tiyuchang-1",
        "cn-shijiazhuang-beisong-1",
        "cn-shijiazhuang-tangu-1",
        "cn-shijiazhuang-zhaohui-qiao-1",
        "cn-shijiazhuang-baifo-1",
        "cn-shijiazhuang-liucun-1",
        "cn-shijiazhuang-huoju-guangchang-1",
        "cn-shijiazhuang-shijiazhuang-dongzhan-1",
        "cn-shijiazhuang-nancun-1",
        "cn-shijiazhuang-xiaohe-dadao-1",
        "cn-shijiazhuang-xizhuang-1",
        "cn-shijiazhuang-dongzhuang-1",
        "cn-shijiazhuang-huizhan-zhongxin-1",
        "cn-shijiazhuang-shangwu-zhongxin-1",
        "cn-shijiazhuang-yuanboyuan-1",
        "cn-shijiazhuang-fuze-1"
      ],
      "origin_stop_id": "cn-shijiazhuang-xiwang-1",
      "terminal_stop_id": "cn-shijiazhuang-fuze-1",
      "is_primary": true,
      "source_ids": [
        {
          "source": "sjzmetro-api",
          "id": "1"
        }
      ],
      "extras": {
        "line_short_name": "1",
        "origin_name": "西王",
        "terminal_name": "福泽"
      }
    },
    {
      "id": "cn-shijiazhuang-line-2-pattern-cn-shijiazhuang-jiahua-lu-2-to-cn-shijiazhuang-liu-xinzhuang-2",
      "line_id": "cn-shijiazhuang-line-2",
      "name": "2号线",
      "names": {
        "zh": "2号线",
        "en": "Line 2"
      },
      "stop_ids": [
        "cn-shijiazhuang-jiahua-lu-2",
        "cn-shijiazhuang-nanwei-2",
        "cn-shijiazhuang-cangfeng-lu-liucun-2",
        "cn-shijiazhuang-tatan-2",
        "cn-shijiazhuang-shijiazhuang-zhan-2",
        "cn-shijiazhuang-yuancun-2",
        "cn-shijiazhuang-ouyun-gongyuan-2",
        "cn-shijiazhuang-huaizhonglu-2",
        "cn-shijiazhuang-yuhua-lu-2",
        "cn-shijiazhuang-beiguo-shangcheng-2",
        "cn-shijiazhuang-changan-gongyuan-2",
        "cn-shijiazhuang-jianhe-qiao-2",
        "cn-shijiazhuang-yitang-2",
        "cn-shijiazhuang-zhuangke-tiedao-daxue-2",
        "cn-shijiazhuang-liu-xinzhuang-2"
      ],
      "origin_stop_id": "cn-shijiazhuang-jiahua-lu-2",
      "terminal_stop_id": "cn-shijiazhuang-liu-xinzhuang-2",
      "is_primary": true,
      "source_ids": [
        {
          "source": "sjzmetro-api",
          "id": "2"
        }
      ],
      "extras": {
        "line_short_name": "2",
        "origin_name": "嘉华路",
        "terminal_name": "柳辛庄"
      }
    },
    {
      "id": "cn-shijiazhuang-line-3-pattern-cn-shijiazhuang-xisanzhuang-3-to-cn-shijiazhuang-lexiang-3",
      "line_id": "cn-shijiazhuang-line-3",
      "name": "3号线",
      "names": {
        "zh": "3号线",
        "en": "Line 3"
      },
      "stop_ids": [
        "cn-shijiazhuang-xisanzhuang-3",
        "cn-shijiazhuang-gaozhu-3",
        "cn-shijiazhuang-bolinzhuang-3",
        "cn-shijiazhuang-shizhuang-3",
        "cn-shijiazhuang-shi-erzhong-3",
        "cn-shijiazhuang-xinbai-guangchang-3",
        "cn-shijiazhuang-dongli-3",
        "cn-shijiazhuang-huaian-qiao-3",
        "cn-shijiazhuang-xisanjiao-3",
        "cn-shijiazhuang-shijiazhuang-zhan-3",
        "cn-shijiazhuang-huitong-lu-3",
        "cn-shijiazhuang-suncun-3",
        "cn-shijiazhuang-tazhong-3",
        "cn-shijiazhuang-dongwang-3",
        "cn-shijiazhuang-nanwang-3",
        "cn-shijiazhuang-weitong-3",
        "cn-shijiazhuang-dongerhuan-nanlu-3",
        "cn-shijiazhuang-xiyangling-3",
        "cn-shijiazhuang-zhongyangling-3",
        "cn-shijiazhuang-nandou-3",
        "cn-shijiazhuang-taihang-nandajie-3",
        "cn-shijiazhuang-lexiang-3"
      ],
      "origin_stop_id": "cn-shijiazhuang-xisanzhuang-3",
      "terminal_stop_id": "cn-shijiazhuang-lexiang-3",
      "is_primary": true,
      "source_ids": [
        {
          "source": "sjzmetro-api",
          "id": "3"
        }
      ],
      "extras": {
        "line_short_name": "3",
        "origin_name": "西三庄",
        "terminal_name": "乐乡"
      }
    }
  ]
}