{
  "$schema": "https://raw.githubusercontent.com/Naptie/openmetro/main/schemas/v1/patterns.schema.json",
  "schema_version": "1.0",
  "network_id": "cn-nanchang",
  "generated_at": "2026-10-23T14:59:29.001Z",
  "source": [],
  "records": [
    {
      "id": "cn-nanchang-line-1-pattern-main",
      "line_id": "cn-nanchang-line-1",
      "name": "1号线",
      "names": {
        "zh": "1号线",
        "en": "Line 1"
      },
      "stop_ids": [
        "cn-nanchang-changbei-airport-1",
        "cn-nanchang-huixian-avenue-1",
        "cn-nanchang-jianye-avenue-1",
        "cn-nanchang-dingzishan-1",
        "cn-nanchang-guanshan-1",
        "cn-nanchang-nanchang-gear-factory-1",
        "cn-nanchang-fang-zhimin-avenue-1",
        "cn-nanchang-jiaoqiao-1",
        "cn-nanchang-shuanggang-1",
        "cn-nanchang-kongmuhu-lake-1",
        "cn-nanchang-changjiang-road-1",
        "cn-nanchang-zhujiang-road-1",
        "cn-nanchang-south-lushan-avenue-1",
        "cn-nanchang-luyin-road-1",
        "cn-nanchang-weidong-1",
        "cn-nanchang-metro-central-1",
        "cn-nanchang-qiushui-square-1",
        "cn-nanchang-tengwang-pavilion-1",
        "cn-nanchang-wanshou-palace-1",
        "cn-nanchang-bayi-memorial-1",
        "cn-nanchang-bayi-square-1",
        "cn-nanchang-dinggong-road-north-1",
        "cn-nanchang-shidanan-road-1",
        "cn-nanchang-pengjiaqiao-1",
        "cn-nanchang-xiejiacun-1",
        "cn-nanchang-qingshanhu-avenue-1",
        "cn-nanchang-gaoxin-avenue-1",
        "cn-nanchang-aixihu-lake-west-1",
        "cn-nanchang-aixihu-lake-east-1",
        "cn-nanchang-taizidian-1",
        "cn-nanchang-olympic-stadium-1",
        "cn-nanchang-yaohu-lake-west-1",
        "cn-nanchang-yaohu-lake-east-1",
        "cn-nanchang-maqiu-1"
      ],
      "origin_stop_id": "cn-nanchang-changbei-airport-1",
      "terminal_stop_id": "cn-nanchang-maqiu-1",
      "is_primary": true,
      "source_ids": [
        {
          "source": "ncmtr-allline",
          "id": "1"
        }
      ],
      "extras": {
        "line_short_name": "1",
        "origin_name": "昌北机场",
        "terminal_name": "麻丘"
      }
    },
    {
      "id": "cn-nanchang-line-2-pattern-main",
      "line_id": "cn-nanchang-line-2",
      "name": "2号线",
      "names": {
        "zh": "2号线",
        "en": "Line 2"
      },
      "stop_ids": [
        "cn-nanchang-nanlu-2",
        "cn-nanchang-nanchang-middle-school-2",
        "cn-nanchang-shengmi-2",
        "cn-nanchang-jiulong-lake-south-2",
        "cn-nanchang-civic-center-2",
        "cn-nanchang-yingtan-street-2",
        "cn-nanchang-international-expo-center-2",
        "cn-nanchang-south-square-of-west-railway-station-2",
        "cn-nanchang-nanchang-west-railway-station-2",
        "cn-nanchang-longgang-2",
        "cn-nanchang-international-sports-center-2",
        "cn-nanchang-wolongshan-2",
        "cn-nanchang-lingbei-2",
        "cn-nanchang-qianhu-avenue-2",
        "cn-nanchang-xuefu-avenue-east-2",
        "cn-nanchang-cuiyuan-road-2",
        "cn-nanchang-metro-central-2",
        "cn-nanchang-yayuan-road-2",
        "cn-nanchang-middle-honggu-avenue-2",
        "cn-nanchang-yangming-park-2",
        "cn-nanchang-qingshan-road-2",
        "cn-nanchang-fuzhou-road-2",
        "cn-nanchang-bayi-square-2",
        "cn-nanchang-yongshu-road-2",
        "cn-nanchang-dinggong-road-south-2",
        "cn-nanchang-nanchang-railway-station-2",
        "cn-nanchang-shunwai-2",
        "cn-nanchang-xinjiaan-2",
        "cn-nanchang-lengshang-2",
        "cn-nanchang-beiluo-2",
        "cn-nanchang-lixiang-2",
        "cn-nanchang-shenqiao-2",
        "cn-nanchang-guantian-2",
        "cn-nanchang-luojiaji-2",
        "cn-nanchang-fengxia-2",
        "cn-nanchang-international-exhibition-center-2",
        "cn-nanchang-nanchang-east-railway-station-2"
      ],
      "origin_stop_id": "cn-nanchang-nanlu-2",
      "terminal_stop_id": "cn-nanchang-nanchang-east-railway-station-2",
      "is_primary": true,
      "source_ids": [
        {
          "source": "ncmtr-allline",
          "id": "2"
        }
      ],
      "extras": {
        "line_short_name": "2",
        "origin_name": "南路",
        "terminal_name": "南昌东"
      }
    },
    {
      "id": "cn-nanchang-line-3-pattern-main",
      "line_id": "cn-nanchang-line-3",
      "name": "3号线",
      "names": {
        "zh": "3号线",
        "en": "Line 3"
      },
      "stop_ids": [
        "cn-nanchang-yinsanjiao-north-3",
        "cn-nanchang-doumen-3",
        "cn-nanchang-baigang-3",
        "cn-nanchang-lishan-3",
        "cn-nanchang-fuxing-avenue-east-3",
        "cn-nanchang-dengbu-3",
        "cn-nanchang-badashanren-3",
        "cn-nanchang-shiyao-3",
        "cn-nanchang-jiangling-3",
        "cn-nanchang-jingjiashan-3",
        "cn-nanchang-shizijie-3",
        "cn-nanchang-shengjin-pagoda-3",
        "cn-nanchang-liuyanjing-3",
        "cn-nanchang-bayi-memorial-3",
        "cn-nanchang-dunzitang-3",
        "cn-nanchang-qingshan-road-3",
        "cn-nanchang-shangshagou-3",
        "cn-nanchang-qingshanhu-lake-west-3",
        "cn-nanchang-guowei-road-3",
        "cn-nanchang-huoju-square-3",
        "cn-nanchang-liangwan-3",
        "cn-nanchang-jingdong-avenue-3"
      ],
      "origin_stop_id": "cn-nanchang-yinsanjiao-north-3",
      "terminal_stop_id": "cn-nanchang-jingdong-avenue-3",
      "is_primary": true,
      "source_ids": [
        {
          "source": "ncmtr-allline",
          "id": "3"
        }
      ],
      "extras": {
        "line_short_name": "3",
        "origin_name": "银三角北",
        "terminal_name": "京东大道"
      }
    },
    {
      "id": "cn-nanchang-line-4-pattern-main",
      "line_id": "cn-nanchang-line-4",
      "name": "4号线",
      "names": {
        "zh": "4号线",
        "en": "Line 4"
      },
      "stop_ids": [
        "cn-nanchang-baimashan-4",
        "cn-nanchang-yufeng-street-4",
        "cn-nanchang-huangxi-4",
        "cn-nanchang-zhongbao-4",
        "cn-nanchang-lizhuangshan-4",
        "cn-nanchang-south-square-of-west-railway-station-4",
        "cn-nanchang-huaiyushan-avenue-4",
        "cn-nanchang-anfeng-4",
        "cn-nanchang-dongxin-4",
        "cn-nanchang-new-hongcheng-market-4",
        "cn-nanchang-dingjiazhou-4",
        "cn-nanchang-guanzhou-4",
        "cn-nanchang-yuntian-road-4",
        "cn-nanchang-guanying-road-4",
        "cn-nanchang-nanchang-bridge-east-4",
        "cn-nanchang-taoyuan-4",
        "cn-nanchang-shengjin-pagoda-4",
        "cn-nanchang-tanzikou-4",
        "cn-nanchang-dinggong-road-south-4",
        "cn-nanchang-dinggong-road-north-4",
        "cn-nanchang-people-s-park-4",
        "cn-nanchang-shangshagou-4",
        "cn-nanchang-qifeng-road-4",
        "cn-nanchang-qili-4",
        "cn-nanchang-minyuan-road-west-4",
        "cn-nanchang-huoju-4",
        "cn-nanchang-beili-4",
        "cn-nanchang-high-tech-park-4",
        "cn-nanchang-yuweizhou-4"
      ],
      "origin_stop_id": "cn-nanchang-baimashan-4",
      "terminal_stop_id": "cn-nanchang-yuweizhou-4",
      "is_primary": true,
      "source_ids": [
        {
          "source": "ncmtr-allline",
          "id": "4"
        }
      ],
      "extras": {
        "line_short_name": "4",
        "origin_name": "白马山",
        "terminal_name": "鱼尾洲"
      }
    }
  ]
}