{
  "$schema": "https://raw.githubusercontent.com/Naptie/openmetro/main/schemas/v1/patterns.schema.json",
  "schema_version": "1.0",
  "network_id": "cn-taichung",
  "generated_at": "2026-10-15T09:25:23.671Z",
  "source": [
    {
      "name": "tmrt-stations",
      "url": "https://newdatacenter.taichung.gov.tw/api/v1/no-auth/resource.download?rid=f9511cc5-4799-4df9-98b7-0b0f89fc2be9",
      "version": "live",
      "retrieved_at": "2026-10-15T09:25:23.669Z",
      "license": "custom",
      "license_url": "https://data.gov.tw/license",
      "attribution": "提供機關／臺中捷運股份有限公司：臺中捷運綠線車站資訊、站間票價、站間行車時間及首末班車時刻表。此開放資料依政府資料開放授權條款第1版釋出。",
      "notes": "Operator station identity from tmrt.com.tw; open datasets published under OGDL-1.0."
    },
    {
      "name": "tmrt-fares",
      "url": "https://newdatacenter.taichung.gov.tw/api/v1/no-auth/resource.download?rid=261c5b91-8f02-4c17-8a97-23c1384eced7",
      "version": "live",
      "retrieved_at": "2026-10-15T09:25:23.669Z",
      "license": "custom",
      "license_url": "https://data.gov.tw/license",
      "attribution": "提供機關／臺中捷運股份有限公司：臺中捷運綠線車站資訊、站間票價、站間行車時間及首末班車時刻表。此開放資料依政府資料開放授權條款第1版釋出。",
      "notes": "Operator station identity from tmrt.com.tw; open datasets published under OGDL-1.0."
    },
    {
      "name": "tmrt-runtimes",
      "url": "https://newdatacenter.taichung.gov.tw/api/v1/no-auth/resource.download?rid=4edec91c-05c8-4dee-9f93-7ab3cef20fc3",
      "version": "live",
      "retrieved_at": "2026-10-15T09:25:23.669Z",
      "license": "custom",
      "license_url": "https://data.gov.tw/license",
      "attribution": "提供機關／臺中捷運股份有限公司：臺中捷運綠線車站資訊、站間票價、站間行車時間及首末班車時刻表。此開放資料依政府資料開放授權條款第1版釋出。",
      "notes": "Operator station identity from tmrt.com.tw; open datasets published under OGDL-1.0."
    },
    {
      "name": "tmrt-timetables",
      "url": "https://newdatacenter.taichung.gov.tw/api/v1/no-auth/resource.download?rid=fabf5eb7-c161-4b77-bf7c-6c6449fe5a89",
      "version": "live",
      "retrieved_at": "2026-10-15T09:25:23.669Z",
      "license": "custom",
      "license_url": "https://data.gov.tw/license",
      "attribution": "提供機關／臺中捷運股份有限公司：臺中捷運綠線車站資訊、站間票價、站間行車時間及首末班車時刻表。此開放資料依政府資料開放授權條款第1版釋出。",
      "notes": "Operator station identity from tmrt.com.tw; open datasets published under OGDL-1.0."
    },
    {
      "name": "tmrt-officialStations",
      "url": "https://www.tmrt.com.tw/metro-life/ride-time-and-fare",
      "version": "live",
      "retrieved_at": "2026-10-15T09:25:23.669Z",
      "license": "unknown",
      "license_url": null,
      "attribution": "臺中捷運股份有限公司；官方車站清單、站名、順序及識別碼。",
      "notes": "Operator station identity from tmrt.com.tw; open datasets published under OGDL-1.0."
    }
  ],
  "records": [
    {
      "id": "cn-taichung-line-g-main",
      "line_id": "cn-taichung-line-g",
      "name": "綠線",
      "stop_ids": [
        "cn-taichung-103a-g",
        "cn-taichung-103-g",
        "cn-taichung-104-g",
        "cn-taichung-105-g",
        "cn-taichung-106-g",
        "cn-taichung-107-g",
        "cn-taichung-108-g",
        "cn-taichung-109-g",
        "cn-taichung-110-g",
        "cn-taichung-111-g",
        "cn-taichung-112-g",
        "cn-taichung-113-g",
        "cn-taichung-114-g",
        "cn-taichung-115-g",
        "cn-taichung-116-g",
        "cn-taichung-117-g",
        "cn-taichung-118-g",
        "cn-taichung-119-g"
      ],
      "origin_stop_id": "cn-taichung-103a-g",
      "terminal_stop_id": "cn-taichung-119-g",
      "is_primary": true,
      "source_ids": [
        {
          "source": "tmrt-stations",
          "id": "G"
        }
      ]
    }
  ]
}