{
  "$schema": "https://raw.githubusercontent.com/Naptie/openmetro/main/schemas/v1/patterns.schema.json",
  "schema_version": "1.0",
  "network_id": "cn-guiyang",
  "generated_at": "2026-10-23T14:51:48.862Z",
  "source": [],
  "records": [
    {
      "id": "cn-guiyang-line-1-pattern-main",
      "line_id": "cn-guiyang-line-1",
      "name": "1号线",
      "names": {
        "zh": "1号线",
        "en": "Line 1"
      },
      "stop_ids": [
        "cn-guiyang-douguan-1",
        "cn-guiyang-xiamaixi-1",
        "cn-guiyang-laowantang-1",
        "cn-guiyang-yueshanhu-park-1",
        "cn-guiyang-west-lincheng-road-1",
        "cn-guiyang-guanshanhu-park-1",
        "cn-guiyang-international-eco-conference-center-1",
        "cn-guiyang-yangguan-1",
        "cn-guiyang-xinzhai-1",
        "cn-guiyang-bailu-lake-1",
        "cn-guiyang-guiyangbei-railway-station-1",
        "cn-guiyang-yaguan-1",
        "cn-guiyang-nanya-road-1",
        "cn-guiyang-bageyan-1",
        "cn-guiyang-beijing-road-1",
        "cn-guiyang-penshuichi-1",
        "cn-guiyang-west-zhongshan-road-1",
        "cn-guiyang-hebin-park-1",
        "cn-guiyang-guiyang-railway-station-1",
        "cn-guiyang-shachong-road-1",
        "cn-guiyang-wangchengpo-1",
        "cn-guiyang-zhujiang-road-1",
        "cn-guiyang-changjiang-road-1",
        "cn-guiyang-qingshuijiang-road-1",
        "cn-guiyang-xiaomai-industrial-park-1"
      ],
      "origin_stop_id": "cn-guiyang-douguan-1",
      "terminal_stop_id": "cn-guiyang-xiaomai-industrial-park-1",
      "is_primary": true,
      "source_ids": [
        {
          "source": "gyurt-subway-inquiry",
          "id": "1"
        }
      ],
      "extras": {
        "line_short_name": "1",
        "origin_name": "cn-guiyang-douguan-1",
        "terminal_name": "cn-guiyang-xiaomai-industrial-park-1"
      }
    },
    {
      "id": "cn-guiyang-line-2-pattern-main",
      "line_id": "cn-guiyang-line-2",
      "name": "2号线",
      "names": {
        "zh": "2号线",
        "en": "Line 2"
      },
      "stop_ids": [
        "cn-guiyang-north-baiyun-road-2",
        "cn-guiyang-middle-baiyun-road-2",
        "cn-guiyang-yunfeng-avenue-2",
        "cn-guiyang-quanhu-park-2",
        "cn-guiyang-fenglin-road-2",
        "cn-guiyang-chengxin-road-2",
        "cn-guiyang-west-lincheng-road-2",
        "cn-guiyang-west-guanshan-road-2",
        "cn-guiyang-xingzhu-road-2",
        "cn-guiyang-jinyang-hospital-2",
        "cn-guiyang-south-jinyang-road-2",
        "cn-guiyang-chayuan-2",
        "cn-guiyang-baihua-avenue-2",
        "cn-guiyang-mawangmiao-2",
        "cn-guiyang-west-beijing-road-2",
        "cn-guiyang-gaicha-road-2",
        "cn-guiyang-qianchun-road-2",
        "cn-guiyang-west-yan-an-road-2",
        "cn-guiyang-zilinan-2",
        "cn-guiyang-penshuichi-2",
        "cn-guiyang-yangming-ancestral-temple-2",
        "cn-guiyang-provincial-general-hospital-2",
        "cn-guiyang-south-baoshan-road-2",
        "cn-guiyang-youzha-street-2",
        "cn-guiyang-guigang-2",
        "cn-guiyang-north-fuyuan-road-2",
        "cn-guiyang-forest-park-2",
        "cn-guiyang-jianlongdong-2",
        "cn-guiyang-longdongbao-international-airport-2",
        "cn-guiyang-xiaobi-2",
        "cn-guiyang-yunpan-2",
        "cn-guiyang-zhongxing-road-2"
      ],
      "origin_stop_id": "cn-guiyang-north-baiyun-road-2",
      "terminal_stop_id": "cn-guiyang-zhongxing-road-2",
      "is_primary": true,
      "source_ids": [
        {
          "source": "gyurt-subway-inquiry",
          "id": "2"
        }
      ],
      "extras": {
        "line_short_name": "2",
        "origin_name": "cn-guiyang-north-baiyun-road-2",
        "terminal_name": "cn-guiyang-zhongxing-road-2"
      }
    },
    {
      "id": "cn-guiyang-line-3-pattern-main",
      "line_id": "cn-guiyang-line-3",
      "name": "3号线",
      "names": {
        "zh": "3号线",
        "en": "Line 3"
      },
      "stop_ids": [
        "cn-guiyang-luowan-3",
        "cn-guiyang-dongfeng-guiqian-hospital-3",
        "cn-guiyang-guizhou-normal-university-3",
        "cn-guiyang-gaoxin-road-3",
        "cn-guiyang-xintian-3",
        "cn-guiyang-shunhai-3",
        "cn-guiyang-chadian-3",
        "cn-guiyang-dayingpo-3",
        "cn-guiyang-guizhou-medical-university-3",
        "cn-guiyang-beijing-road-3",
        "cn-guiyang-qianlingshan-park-3",
        "cn-guiyang-west-yan-an-road-3",
        "cn-guiyang-songhua-road-3",
        "cn-guiyang-huaguoyuan-3",
        "cn-guiyang-wulichong-3",
        "cn-guiyang-taiciqiao-3",
        "cn-guiyang-zaojiaojing-3",
        "cn-guiyang-sifanghe-guizhou-provincial-hospital-of-traditional-chinese-medicine-3",
        "cn-guiyang-ganyintang-3",
        "cn-guiyang-zhongcaosi-3",
        "cn-guiyang-shilihetan-3",
        "cn-guiyang-kongxuetang-3",
        "cn-guiyang-guizhou-university-3",
        "cn-guiyang-huaxi-park-3",
        "cn-guiyang-xueshi-road-3",
        "cn-guiyang-mingzhu-avenue-3",
        "cn-guiyang-huaxinan-railway-station-3",
        "cn-guiyang-langfengguan-3",
        "cn-guiyang-tongmuling-party-school-of-the-cpc-guizhou-provincial-committee-3"
      ],
      "origin_stop_id": "cn-guiyang-luowan-3",
      "terminal_stop_id": "cn-guiyang-tongmuling-party-school-of-the-cpc-guizhou-provincial-committee-3",
      "is_primary": true,
      "source_ids": [
        {
          "source": "gyurt-subway-inquiry",
          "id": "3"
        }
      ],
      "extras": {
        "line_short_name": "3",
        "origin_name": "cn-guiyang-luowan-3",
        "terminal_name": "cn-guiyang-tongmuling-party-school-of-the-cpc-guizhou-provincial-committee-3"
      }
    },
    {
      "id": "cn-guiyang-line-s1-pattern-main",
      "line_id": "cn-guiyang-line-s1",
      "name": "S1线",
      "names": {
        "zh": "S1线",
        "en": "Line S1"
      },
      "stop_ids": [
        "cn-guiyang-zaojiaoba-S1",
        "cn-guiyang-gui-an-S1",
        "cn-guiyang-dakecheng-S1",
        "cn-guiyang-shugu-avenue-S1",
        "cn-guiyang-xingyuehu-S1",
        "cn-guiyang-dalongjing-S1",
        "cn-guiyang-tianhetan-S1",
        "cn-guiyang-shibanshao-S1",
        "cn-guiyang-jinzhu-S1",
        "cn-guiyang-zhongcaosi-S1",
        "cn-guiyang-jinjiang-road-S1",
        "cn-guiyang-xiaohe-S1",
        "cn-guiyang-wangchengpo-S1"
      ],
      "origin_stop_id": "cn-guiyang-zaojiaoba-S1",
      "terminal_stop_id": "cn-guiyang-wangchengpo-S1",
      "is_primary": true,
      "source_ids": [
        {
          "source": "gyurt-subway-inquiry",
          "id": "S1"
        }
      ],
      "extras": {
        "line_short_name": "S1",
        "origin_name": "cn-guiyang-zaojiaoba-S1",
        "terminal_name": "cn-guiyang-wangchengpo-S1"
      }
    }
  ]
}