{
  "$schema": "https://raw.githubusercontent.com/Naptie/openmetro/main/schemas/v1/patterns.schema.json",
  "schema_version": "1.0",
  "network_id": "cn-fuzhou",
  "generated_at": "2026-10-12T11:00:52.857Z",
  "source": [],
  "records": [
    {
      "id": "cn-fuzhou-pattern-1-primary",
      "line_id": "cn-fuzhou-line-1",
      "name": "象峰 → 三江口",
      "names": {
        "zh": "象峰→三江口",
        "en": "象峰 to 三江口"
      },
      "stop_ids": [
        "cn-fuzhou-xiangfeng-1",
        "cn-fuzhou-xiushan-1",
        "cn-fuzhou-luohanshan-1",
        "cn-fuzhou-fuzhou-railway-station-1",
        "cn-fuzhou-doumen-1",
        "cn-fuzhou-shudou-1",
        "cn-fuzhou-pingshan-1",
        "cn-fuzhou-dongjiekou-1",
        "cn-fuzhou-nanmendou-1",
        "cn-fuzhou-chating-1",
        "cn-fuzhou-dadao-1",
        "cn-fuzhou-shangteng-1",
        "cn-fuzhou-sanchajie-1",
        "cn-fuzhou-baihuting-1",
        "cn-fuzhou-huluzhen-1",
        "cn-fuzhou-huangshan-1",
        "cn-fuzhou-paixia-1",
        "cn-fuzhou-chengmen-1",
        "cn-fuzhou-sanjiaocheng-1",
        "cn-fuzhou-lulei-1",
        "cn-fuzhou-fuzhou-south-railway-station-1",
        "cn-fuzhou-anping-1",
        "cn-fuzhou-liangcuo-1",
        "cn-fuzhou-xiayang-1",
        "cn-fuzhou-sanjiangkou-1"
      ],
      "origin_stop_id": "cn-fuzhou-xiangfeng-1",
      "terminal_stop_id": "cn-fuzhou-sanjiangkou-1",
      "is_primary": true,
      "source_ids": [
        {
          "source": "fzmtr-services-schedule",
          "id": "749893281398853"
        }
      ],
      "extras": {
        "line_short_name": "1"
      }
    },
    {
      "id": "cn-fuzhou-pattern-2-primary",
      "line_id": "cn-fuzhou-line-2",
      "name": "苏洋 → 洋里",
      "names": {
        "zh": "苏洋→洋里",
        "en": "苏洋 to 洋里"
      },
      "stop_ids": [
        "cn-fuzhou-suyang-2",
        "cn-fuzhou-shadi-2",
        "cn-fuzhou-shangjie-2",
        "cn-fuzhou-jinyu-2",
        "cn-fuzhou-fuzhou-university-2",
        "cn-fuzhou-dongyu-fujian-normal-university-2",
        "cn-fuzhou-houting-2",
        "cn-fuzhou-juyuanzhou-2",
        "cn-fuzhou-hongwan-2",
        "cn-fuzhou-jinshan-2",
        "cn-fuzhou-jinxiang-2",
        "cn-fuzhou-xiangban-2",
        "cn-fuzhou-ninghua-2",
        "cn-fuzhou-xiyang-2",
        "cn-fuzhou-nanmendou-2",
        "cn-fuzhou-shuibu-2",
        "cn-fuzhou-ziyang-2",
        "cn-fuzhou-wuliting-2",
        "cn-fuzhou-qianyu-2",
        "cn-fuzhou-shangyang-2",
        "cn-fuzhou-gushan-2",
        "cn-fuzhou-yangli-2"
      ],
      "origin_stop_id": "cn-fuzhou-suyang-2",
      "terminal_stop_id": "cn-fuzhou-yangli-2",
      "is_primary": true,
      "source_ids": [
        {
          "source": "fzmtr-services-schedule",
          "id": "749893306720325"
        }
      ],
      "extras": {
        "line_short_name": "2"
      }
    },
    {
      "id": "cn-fuzhou-pattern-4-primary",
      "line_id": "cn-fuzhou-line-4",
      "name": "半洲 → 帝封江",
      "names": {
        "zh": "半洲→帝封江",
        "en": "半洲 to 帝封江"
      },
      "stop_ids": [
        "cn-fuzhou-banzhou-4",
        "cn-fuzhou-jianxin-4",
        "cn-fuzhou-hongtang-4",
        "cn-fuzhou-jinniushan-4",
        "cn-fuzhou-fenghuangchi-4",
        "cn-fuzhou-luzhuang-4",
        "cn-fuzhou-ximen-4",
        "cn-fuzhou-dongjiekou-4",
        "cn-fuzhou-provincial-hospital-4",
        "cn-fuzhou-dongmen-4",
        "cn-fuzhou-sanjiaochi-4",
        "cn-fuzhou-zhuyu-4",
        "cn-fuzhou-hengyu-4",
        "cn-fuzhou-houyu-4",
        "cn-fuzhou-qianyu-4",
        "cn-fuzhou-guangminggang-4",
        "cn-fuzhou-aofengzhou-4",
        "cn-fuzhou-huahai-park-4",
        "cn-fuzhou-exhibition-center-4",
        "cn-fuzhou-linpu-4",
        "cn-fuzhou-chengmen-4",
        "cn-fuzhou-luozhou-hot-spring-4",
        "cn-fuzhou-difengjiang-4"
      ],
      "origin_stop_id": "cn-fuzhou-banzhou-4",
      "terminal_stop_id": "cn-fuzhou-difengjiang-4",
      "is_primary": true,
      "source_ids": [
        {
          "source": "fzmtr-services-schedule",
          "id": "749893337657413"
        }
      ],
      "extras": {
        "line_short_name": "4"
      }
    },
    {
      "id": "cn-fuzhou-pattern-5-primary",
      "line_id": "cn-fuzhou-line-5",
      "name": "荆溪厚屿 → 福州火车南站",
      "names": {
        "zh": "荆溪厚屿→福州火车南站",
        "en": "荆溪厚屿 to 福州火车南站"
      },
      "stop_ids": [
        "cn-fuzhou-jingxi-houyu-5",
        "cn-fuzhou-agriculture-and-forestry-university-5",
        "cn-fuzhou-hongtang-5",
        "cn-fuzhou-zhenban-5",
        "cn-fuzhou-marong-5",
        "cn-fuzhou-jinshan-5",
        "cn-fuzhou-fenggangli-5",
        "cn-fuzhou-pushang-dadao-5",
        "cn-fuzhou-xiajing-5",
        "cn-fuzhou-dongling-5",
        "cn-fuzhou-taiyu-5",
        "cn-fuzhou-panyu-5",
        "cn-fuzhou-wushan-5",
        "cn-fuzhou-gaishan-zhulan-5",
        "cn-fuzhou-yixu-5",
        "cn-fuzhou-difengjiang-5",
        "cn-fuzhou-ancient-luozhou-town-5",
        "cn-fuzhou-qianjin-5",
        "cn-fuzhou-longjiang-5",
        "cn-fuzhou-fuzhou-south-railway-station-5"
      ],
      "origin_stop_id": "cn-fuzhou-jingxi-houyu-5",
      "terminal_stop_id": "cn-fuzhou-fuzhou-south-railway-station-5",
      "is_primary": true,
      "source_ids": [
        {
          "source": "fzmtr-services-schedule",
          "id": "749893359800389"
        }
      ],
      "extras": {
        "line_short_name": "5"
      }
    },
    {
      "id": "cn-fuzhou-pattern-6-primary",
      "line_id": "cn-fuzhou-line-6",
      "name": "潘墩 → 万寿",
      "names": {
        "zh": "潘墩→万寿",
        "en": "潘墩 to 万寿"
      },
      "stop_ids": [
        "cn-fuzhou-pandun-6",
        "cn-fuzhou-linpu-6",
        "cn-fuzhou-zhanglan-6",
        "cn-fuzhou-liangcuo-6",
        "cn-fuzhou-xiayang-6",
        "cn-fuzhou-yingqian-6",
        "cn-fuzhou-hangcheng-6",
        "cn-fuzhou-zhenghe-6",
        "cn-fuzhou-shiyang-6",
        "cn-fuzhou-wuhang-6",
        "cn-fuzhou-heshang-6",
        "cn-fuzhou-shajing-6",
        "cn-fuzhou-xiawu-6",
        "cn-fuzhou-wanshou-6"
      ],
      "origin_stop_id": "cn-fuzhou-pandun-6",
      "terminal_stop_id": "cn-fuzhou-wanshou-6",
      "is_primary": true,
      "source_ids": [
        {
          "source": "fzmtr-services-schedule",
          "id": "749893399121989"
        }
      ],
      "extras": {
        "line_short_name": "6"
      }
    },
    {
      "id": "cn-fuzhou-pattern-eg37cz-primary",
      "line_id": "cn-fuzhou-line-eg37cz",
      "name": "福州火车站 → 文岭",
      "names": {
        "zh": "福州火车站→文岭",
        "en": "福州火车站 to 文岭"
      },
      "stop_ids": [
        "cn-fuzhou-fuzhou-railway-station-滨海快线",
        "cn-fuzhou-dongmen-滨海快线",
        "cn-fuzhou-mindu-滨海快线",
        "cn-fuzhou-nangongyuan-滨海快线",
        "cn-fuzhou-sanchajie-滨海快线",
        "cn-fuzhou-difengjiang-滨海快线",
        "cn-fuzhou-xiangqian-滨海快线",
        "cn-fuzhou-shouzhan-滨海快线",
        "cn-fuzhou-dashuju-滨海快线",
        "cn-fuzhou-binhai-cbd-滨海快线",
        "cn-fuzhou-airport-滨海快线",
        "cn-fuzhou-wenling-滨海快线"
      ],
      "origin_stop_id": "cn-fuzhou-fuzhou-railway-station-滨海快线",
      "terminal_stop_id": "cn-fuzhou-wenling-滨海快线",
      "is_primary": true,
      "source_ids": [
        {
          "source": "fzmtr-services-schedule",
          "id": "749893426626629"
        }
      ],
      "extras": {
        "line_short_name": "滨海快线"
      }
    }
  ]
}