{
  "$schema": "https://raw.githubusercontent.com/Naptie/openmetro/main/schemas/v1/patterns.schema.json",
  "schema_version": "1.0",
  "network_id": "cn-harbin",
  "generated_at": "2026-10-22T14:36:34.729Z",
  "source": [],
  "records": [
    {
      "id": "cn-harbin-pattern-1-primary",
      "line_id": "cn-harbin-line-1",
      "name": "新疆大街 → 哈尔滨东站",
      "names": {
        "zh": "新疆大街→哈尔滨东站",
        "en": "新疆大街 to 哈尔滨东站"
      },
      "stop_ids": [
        "cn-harbin-xinjiang-street-1",
        "cn-harbin-bohai-road-1",
        "cn-harbin-jingpo-road-1",
        "cn-harbin-wapenyao-1",
        "cn-harbin-tongjiang-road-1",
        "cn-harbin-harbin-south-railway-station-1",
        "cn-harbin-hada-1",
        "cn-harbin-the-second-affiliated-hospital-of-harbin-medical-university-1",
        "cn-harbin-heilongjiang-university-1",
        "cn-harbin-harbin-university-of-science-and-technology-1",
        "cn-harbin-xuefu-road-1",
        "cn-harbin-hexing-road-1",
        "cn-harbin-xidaqiao-1",
        "cn-harbin-harbin-institute-of-technology-1",
        "cn-harbin-harbin-railway-co-ltd-1",
        "cn-harbin-museum-of-heilongjiang-province-1",
        "cn-harbin-the-first-affiliated-hospital-of-harbin-medical-university-1",
        "cn-harbin-tobacco-manufacture-1",
        "cn-harbin-harbin-enginering-university-1",
        "cn-harbin-taipingqiao-1",
        "cn-harbin-jiaotongxueyuan-1",
        "cn-harbin-huashu-street-1",
        "cn-harbin-harbin-east-railway-station-1"
      ],
      "origin_stop_id": "cn-harbin-xinjiang-street-1",
      "terminal_stop_id": "cn-harbin-harbin-east-railway-station-1",
      "is_primary": true,
      "source_ids": [
        {
          "source": "amap-subway-2301",
          "id": "1号线"
        }
      ],
      "extras": {
        "line_short_name": "1"
      }
    },
    {
      "id": "cn-harbin-pattern-2-primary",
      "line_id": "cn-harbin-line-2",
      "name": "江北大学城 → 气象台",
      "names": {
        "zh": "江北大学城→气象台",
        "en": "江北大学城 to 气象台"
      },
      "stop_ids": [
        "cn-harbin-jiangbei-university-town-2",
        "cn-harbin-harbin-north-railway-station-2",
        "cn-harbin-dagengjia-2",
        "cn-harbin-longchuan-road-2",
        "cn-harbin-shimao-avenue-2",
        "cn-harbin-ice-and-snow-world-2",
        "cn-harbin-sun-island-2",
        "cn-harbin-peoples-square-2",
        "cn-harbin-zhongyang-street-2",
        "cn-harbin-shangzhi-street-2",
        "cn-harbin-harbin-railway-station-2",
        "cn-harbin-museum-of-heilongjiang-province-2",
        "cn-harbin-workers-cultural-palace-2",
        "cn-harbin-the-peoples-government-of-heilongjiang-province-2",
        "cn-harbin-provincial-hospital-2",
        "cn-harbin-zhujiang-road-2",
        "cn-harbin-nanzhi-road-2",
        "cn-harbin-northeast-agricultural-university-2",
        "cn-harbin-meteorological-observatory-2"
      ],
      "origin_stop_id": "cn-harbin-jiangbei-university-town-2",
      "terminal_stop_id": "cn-harbin-meteorological-observatory-2",
      "is_primary": true,
      "source_ids": [
        {
          "source": "amap-subway-2301",
          "id": "2号线"
        }
      ],
      "extras": {
        "line_short_name": "2"
      }
    },
    {
      "id": "cn-harbin-pattern-3-primary",
      "line_id": "cn-harbin-line-3",
      "name": "3号线环线",
      "names": {
        "zh": "3号线环线",
        "en": "Line 3 loop"
      },
      "stop_ids": [
        "cn-harbin-jinxiang-street-3",
        "cn-harbin-labor-park-3",
        "cn-harbin-xusheng-street-3",
        "cn-harbin-harbin-medical-university-cancer-hospital-3",
        "cn-harbin-zhengyi-road-3",
        "cn-harbin-the-second-affiliated-hospital-of-harbin-medical-university-3",
        "cn-harbin-haxi-street-3",
        "cn-harbin-kaishengyuan-plaza-3",
        "cn-harbin-harbin-west-railway-station-3",
        "cn-harbin-chengxiang-road-3",
        "cn-harbin-gongnong-street-3",
        "cn-harbin-qunli-hospital-the-first-affiliated-hospital-of-harbin-medical-university-3",
        "cn-harbin-no-5-qunli-avenue-3",
        "cn-harbin-sports-park-3",
        "cn-harbin-lilac-park-3",
        "cn-harbin-heshan-street-3",
        "cn-harbin-hesong-street-3",
        "cn-harbin-highway-bridge-3",
        "cn-harbin-shanghai-street-3",
        "cn-harbin-peoples-square-3",
        "cn-harbin-friendship-palace-hotel-3",
        "cn-harbin-zhaolin-park-3",
        "cn-harbin-beima-road-3",
        "cn-harbin-chinese-baroque-block-3",
        "cn-harbin-harbin-mosque-3",
        "cn-harbin-jingyu-park-3",
        "cn-harbin-taipingqiao-3",
        "cn-harbin-dayoufang-street-3",
        "cn-harbin-second-hospital-of-harbin-city-3",
        "cn-harbin-haihe-east-road-3",
        "cn-harbin-conference-and-exhibition-center-3",
        "cn-harbin-xiangjiang-road-3",
        "cn-harbin-zhujiang-road-3",
        "cn-harbin-gongbin-road-3",
        "cn-harbin-youfang-street-3",
        "cn-harbin-turbine-co-ltd-3"
      ],
      "origin_stop_id": "cn-harbin-jinxiang-street-3",
      "terminal_stop_id": "cn-harbin-turbine-co-ltd-3",
      "is_primary": true,
      "source_ids": [
        {
          "source": "amap-subway-2301",
          "id": "3号线"
        }
      ],
      "extras": {
        "line_short_name": "3",
        "loop": true
      }
    }
  ]
}